{
  "id": 22,
  "name": "Double Cross",
  "difficulty": 3,
  "boardWidth": 300,
  "boardHeight": 400,
  "elements": [
    {
      "id": 1,
      "type": "dot",
      "position": {
        "x": 50,
        "y": 100
      },
      "radius": 15
    },
    {
      "id": 2,
      "type": "dot",
      "position": {
        "x": 250,
        "y": 100
      },
      "radius": 15
    },
    {
      "id": 3,
      "type": "dot",
      "position": {
        "x": 50,
        "y": 300
      },
      "radius": 15
    },
    {
      "id": 4,
      "type": "shape",
      "position": {
        "x": 150,
        "y": 120
      },
      "vertices": [
        {
          "x": 120,
          "y": 90
        },
        {
          "x": 180,
          "y": 90
        },
        {
          "x": 180,
          "y": 150
        },
        {
          "x": 120,
          "y": 150
        }
      ]
    },
    {
      "id": 5,
      "type": "shape",
      "position": {
        "x": 150,
        "y": 280
      },
      "vertices": [
        {
          "x": 120,
          "y": 250
        },
        {
          "x": 180,
          "y": 250
        },
        {
          "x": 180,
          "y": 310
        },
        {
          "x": 120,
          "y": 310
        }
      ]
    },
    {
      "id": 6,
      "type": "red-area",
      "position": {
        "x": 150,
        "y": 200
      },
      "vertices": [
        {
          "x": 110,
          "y": 170
        },
        {
          "x": 190,
          "y": 170
        },
        {
          "x": 190,
          "y": 230
        },
        {
          "x": 110,
          "y": 230
        }
      ]
    },
    {
      "id": 7,
      "type": "red-area",
      "position": {
        "x": 220,
        "y": 300
      },
      "vertices": [
        {
          "x": 200,
          "y": 280
        },
        {
          "x": 240,
          "y": 280
        },
        {
          "x": 240,
          "y": 320
        },
        {
          "x": 200,
          "y": 320
        }
      ]
    }
  ],
  "startHint": {
    "x": 50,
    "y": 100
  }
}
