{
  "id": 9,
  "name": "Four Corners",
  "difficulty": 3,
  "boardWidth": 300,
  "boardHeight": 400,
  "elements": [
    {
      "id": 1,
      "type": "dot",
      "position": { "x": 50, "y": 50 },
      "radius": 15
    },
    {
      "id": 2,
      "type": "dot",
      "position": { "x": 250, "y": 50 },
      "radius": 15
    },
    {
      "id": 3,
      "type": "dot",
      "position": { "x": 50, "y": 350 },
      "radius": 15
    },
    {
      "id": 4,
      "type": "dot",
      "position": { "x": 250, "y": 350 },
      "radius": 15
    },
    {
      "id": 5,
      "type": "red-area",
      "position": { "x": 150, "y": 200 },
      "vertices": [
        { "x": 120, "y": 170 },
        { "x": 180, "y": 170 },
        { "x": 180, "y": 230 },
        { "x": 120, "y": 230 }
      ]
    }
  ],
  "startHint": { "x": 50, "y": 50 }
}
